{
  "schema_version": "1.0.0",
  "state_version": "core-state-v1.0.0",
  "updated_at_utc": "2026-09-30T00:00:00Z",
  "config_version": "observer-v1.0.0",
  "source": "EA_CORE",
  "data_quality": "UNKNOWN",
  "symbol_resolution": "UNRESOLVED",
  "policy_status": "UNSELECTED",
  "risk_status": "POLICY_DATA_UNKNOWN",
  "symbols": [],
  "account_policy": {
    "policy_id": null,
    "config_version": null,
    "source_url": null,
    "policy_timezone": null,
    "account_currency": null,
    "initial_capital": null,
    "daily_reset_hour": null,
    "daily_reset_minute": null,
    "daily_loss_percent_of_initial": null,
    "overall_loss_percent_of_initial": null,
    "overall_floor_mode": null,
    "safety_buffer": null,
    "internal_daily_loss_limit": null,
    "internal_weekly_drawdown_limit": null,
    "status": "UNSELECTED"
  },
  "daily_snapshot": {
    "schema_version": "1.0.0",
    "snapshot_id": "core-daily-unselected",
    "reset_at_utc": "2026-09-30T00:00:00Z",
    "balance_at_reset": 0,
    "equity_at_reset": 0,
    "floating_at_reset": 0,
    "commission": 0,
    "swap": 0,
    "fee": 0,
    "daily_floor": null,
    "overall_floor": null,
    "floor_headroom": null,
    "policy_version": null,
    "snapshot_source": "EA_CORE",
    "reason_code": "POLICY_DATA_UNKNOWN",
    "data_quality": "UNKNOWN"
  },
  "portfolio_snapshot": {
    "schema_version": "1.0.0",
    "snapshot_id": "core-portfolio-unknown",
    "as_of_utc": "2026-09-30T00:00:00Z",
    "account_scope": "UNKNOWN",
    "equity": 0,
    "realized_pnl": 0,
    "floating_pnl": 0,
    "commission": 0,
    "swap": 0,
    "fee": 0,
    "initial_risk_money": 0,
    "projected_loss_to_sl": 0,
    "remaining_loss_to_sl": 0,
    "locked_profit": 0,
    "daily_floor_headroom": null,
    "overall_floor_headroom": null,
    "reconciliation_status": "UNKNOWN",
    "risk_status": "POLICY_DATA_UNKNOWN",
    "data_quality": "UNKNOWN"
  }
}
